{
  "status": "READY",
  "summary": "The Approve locator of the request details page object is ambiguous (strict mode violation); an exact name match fixes the test code without changing any assertion.",
  "diagnosis": {
    "classification": "test-code-issue",
    "explanation": "Both attempts fail in RequestDetailsPage.approve with a strict mode violation: getByRole('button', { name: 'Approve' }) matches two buttons. The locator, not the application, is ambiguous; the requirement under test (REQ-005) is not contradicted.",
    "evidenceRefs": ["E-001", "E-002", "E-003"],
    "confidence": "medium",
    "alternatives": [
      {
        "classification": "application-defect",
        "explanation": "If an \"Approve all\" button is not expected on the details page, the extra control would be an application change for human triage.",
        "evidenceRefs": ["E-001"]
      }
    ],
    "missingEvidence": ["A screenshot or trace of the details page at the time of failure."],
    "recommendedInvestigation": [
      "Confirm in the UI whether an \"Approve all\" control is intended on the request details page."
    ]
  },
  "repair": {
    "changes": [
      {
        "path": "apps/requestflow/pages/request-details.page.ts",
        "content": "import type { Locator, Page } from '@playwright/test';\n\n/** Request details are served at /requests/:id. */\nconst DETAILS_PATH = /\\/requests\\/(?<id>[^/?#]+)$/;\n\nexport type RequestField =\n  | 'Title'\n  | 'Description'\n  | 'Amount'\n  | 'Requester'\n  | 'Status'\n  | 'Review comment'\n  | 'Created'\n  | 'Updated';\n\nexport class RequestDetailsPage {\n  readonly heading: Locator;\n  readonly url = DETAILS_PATH;\n\n  /** Owner actions, offered only on the Employee's own DRAFT. */\n  readonly editLink: Locator;\n  readonly submitButton: Locator;\n\n  /** Review actions, offered only to a Reviewer on a SUBMITTED request. */\n  readonly approveButton: Locator;\n  readonly rejectButton: Locator;\n  readonly rejectionComment: Locator;\n\n  /** Validation feedback rendered by the server after a rejected form submission. */\n  readonly validationAlert: Locator;\n\n  constructor(private readonly page: Page) {\n    this.heading = page.getByRole('heading', { level: 1 });\n    this.editLink = page.getByRole('main').getByRole('link', { name: 'Edit' });\n    this.submitButton = page.getByRole('button', { name: 'Submit for review' });\n    this.approveButton = page.getByRole('button', { name: 'Approve', exact: true });\n    this.rejectButton = page.getByRole('button', { name: 'Reject' });\n    this.rejectionComment = page.getByLabel('Rejection comment');\n    this.validationAlert = page.getByRole('alert');\n  }\n\n  async open(id: string): Promise<void> {\n    await this.page.goto(`/requests/${encodeURIComponent(id)}`);\n  }\n\n  /** The value shown for a field in the details list (`<dt>` term \u2192 its `<dd>` definition). */\n  field(name: RequestField): Locator {\n    return this.page\n      .getByRole('term')\n      .filter({ hasText: new RegExp(`^${name}$`) })\n      .locator('xpath=following-sibling::dd[1]');\n  }\n\n  /** The request ID from the current details URL. Call after the details page has loaded. */\n  requestId(): string {\n    const id = DETAILS_PATH.exec(new URL(this.page.url()).pathname)?.groups?.['id'];\n    if (id === undefined) throw new Error(`Not on a request details page: ${this.page.url()}`);\n    return id;\n  }\n\n  /** Matches the details URL of one specific request, for `expect(page).toHaveURL(...)`. */\n  isUrlOf(id: string): (url: URL) => boolean {\n    return (url) => url.pathname === `/requests/${encodeURIComponent(id)}`;\n  }\n\n  async submitForReview(): Promise<void> {\n    await this.submitButton.click();\n  }\n\n  async approve(): Promise<void> {\n    await this.approveButton.click();\n  }\n\n  async reject(comment: string): Promise<void> {\n    await this.rejectionComment.fill(comment);\n    await this.rejectButton.click();\n  }\n}\n",
        "rationale": "Match the Approve button by its exact accessible name, so it no longer also matches \"Approve all\"."
      }
    ],
    "impact": "Only RequestDetailsPage.approveButton changes; every test that approves through the page object uses the exact name.",
    "expectedBehaviorPreserved": "The approval workflow (CAN-004) still clicks the Approve button and asserts the same statuses in UI and API; no assertion changes.",
    "risks": [
      "If the visible name of the Approve button changes, the exact match fails loudly instead of matching another control."
    ],
    "validationSteps": [
      "After human H7 authorization, run the targeted test: npx playwright test --grep @TC-005-08",
      "Review the diff of the page object before approving at H3."
    ]
  },
  "assumptions": [
    {
      "statement": "The second button belongs to the application under test.",
      "impact": "If it does not, the diagnosis would be environment-related."
    }
  ],
  "findings": [
    {
      "kind": "risk",
      "severity": "info",
      "message": "The evidence is a report excerpt only; no trace was supplied."
    }
  ],
  "contextRequests": []
}
